{
  "schema_version": "1.0",
  "id": "dockerfile",
  "name": "Dockerfile Excellence",
  "description": "Ten-gate Dockerfile enforcement: multi-stage architecture, layer optimization, portability, security, testing, CI, documentation, UX design, release readiness, truth. Hadolint zero warnings, pinned base images, non-root runtime, minimal attack surface, small image size, low memory, low CPU.",
  "restart_policy": "from_failed_gate",
  "phases": [
    {
      "phase": 0,
      "name": "Architecture & Idioms",
      "gate": "architecture",
      "principle": "Is the structure sound, modular, and idiomatic?",
      "mode": "hierarchical",
      "delegates": [
        {
          "agent": "architect",
          "task_template": "Enforce multi-stage build architecture for: ${goal}. Every Dockerfile MUST use multi-stage builds: strictly separate build-time dependencies (compilers, headers, dev tools, test frameworks) from the final runtime image. Final stage MUST use minimal base (alpine, distroless, or scratch where possible). Name every stage (FROM ... AS builder, FROM ... AS runtime). Verify: build artifacts COPY --from=builder, no compiler/header packages in final image, no package manager cache in final image. Enforce single responsibility: one process per container, no supervisord or multi-process patterns. Verify ENTRYPOINT + CMD separation (ENTRYPOINT for binary, CMD for default args). Flag: multiple FROM without named stages, COPY from unnamed stages, final image >100MB for compiled languages or >200MB for interpreted. Score Tech Debt (target 10/10) and Modularity (target 100/100).",
          "verifies": [
            "multi-stage builds on every Dockerfile",
            "build deps separated from runtime",
            "final stage uses minimal base (alpine/distroless/scratch)",
            "every stage named (FROM ... AS)",
            "single process per container",
            "ENTRYPOINT + CMD separation correct",
            "final image size within budget",
            "Tech Debt 10/10 and Modularity 100/100"
          ]
        },
        {
          "agent": "polyglot",
          "task_template": "Enforce Dockerfile best practices and idioms for: ${goal}. Flag: latest tag on base images (pin exact version: node:22.4-alpine3.20), RUN with apt-get install without --no-install-recommends, RUN apt-get install without && apt-get clean && rm -rf /var/lib/apt/lists/*, ADD where COPY suffices (ADD only for URLs or tar extraction), multiple RUN apt-get update (combine with install), COPY . . without .dockerignore, ENV for secrets (use --mount=type=secret), SHELL instruction without justification, MAINTAINER (use LABEL), using root user in final stage. Enforce: COPY --chown for file ownership, HEALTHCHECK instruction, LABEL for metadata (org.opencontainers.image.*), ARG for build-time variables with defaults, heredoc syntax for multi-line RUN (<<EOF), --mount=type=cache for package managers (apt, pip, npm).",
          "verifies": [
            "base images pinned to exact versions (no latest)",
            "apt-get with --no-install-recommends and cleanup",
            "COPY over ADD (unless tar/URL)",
            "no COPY . . without .dockerignore",
            "no secrets in ENV (use --mount=type=secret)",
            "HEALTHCHECK defined",
            "OCI labels for metadata",
            "--mount=type=cache for package managers"
          ]
        },
        {
          "agent": "researcher",
          "task_template": "Conduct deep research on current Dockerfile best practices for: ${goal}. Research: BuildKit features (cache mounts, secret mounts, SSH mounts, heredoc syntax), distroless vs Alpine vs scratch trade-offs, multi-platform builds (docker buildx, --platform), current OCI image spec and label standards, Dockerfile frontend syntax (# syntax=docker/dockerfile:1), Docker Scout and Snyk container scanning, Chainguard images as hardened alternatives, slim toolkit for image analysis, SBOM generation (syft, trivy). Cross-validate findings against Docker official docs, BuildKit docs, and OCI spec. Flag deprecated patterns (MAINTAINER, legacy builder features).",
          "verifies": [
            "BuildKit features researched (cache/secret/SSH mounts)",
            "distroless vs Alpine vs scratch compared",
            "multi-platform build patterns documented",
            "OCI image spec and labels verified",
            "container scanning tools evaluated",
            "deprecated patterns flagged",
            "findings cross-validated (2+ sources)"
          ]
        },
        {
          "agent": "librarian",
          "task_template": "Audit .dockerignore and build context for: ${goal}. Verify .dockerignore exists and excludes: .git, .gitignore, README*, LICENSE, docs/, tests/, node_modules/, __pycache__/, .env*, *.md, .vscode/, .idea/, .DS_Store, *.log, docker-compose*.yml (not needed in image), Dockerfile* (not needed in image), .dockerignore itself, large temp/data files. Verify build context size is minimal (docker build outputs context size). Verify Dockerfile naming: Dockerfile for single, Dockerfile.<variant> for multi (not dockerfile or DOCKERFILE). Verify docker-compose.yml (if present) references correct Dockerfiles. Remove orphaned Dockerfiles not referenced by any compose or CI config. Verify .env.example exists if .env is gitignored.",
          "verifies": [
            ".dockerignore excludes .git, node_modules, tests, docs",
            "build context size minimal",
            "Dockerfile naming convention consistent",
            "docker-compose references correct Dockerfiles",
            "no orphaned Dockerfiles",
            ".env.example present if .env gitignored",
            "no large temp/data files in build context"
          ]
        }
      ],
      "checkpoint": "Multi-stage, pinned bases, clean context, modern idioms, best practices researched, files organized",
      "abort_on_failure": true,
      "failure_message": "Architecture gate failed. Use multi-stage builds, pin base images, and fix .dockerignore."
    },
    {
      "phase": 1,
      "name": "Performance & Resources",
      "gate": "performance",
      "principle": "Is every operation fast, lean, and resource-efficient?",
      "mode": "parallel",
      "delegates": [
        {
          "agent": "optimizer",
          "task_template": "Audit layer ordering and image size for: ${goal}. Enforce optimal layer caching: least-changing instructions first (FROM, ENV, ARG), dependency manifests next (COPY package.json, COPY requirements.txt), dependency install (RUN npm ci, RUN pip install), frequently changing files last (COPY . .). Combine RUN commands to minimize layer count (single RUN with && for related operations). Use --mount=type=cache for package managers: apt (/var/cache/apt), pip (/root/.cache/pip), npm (/root/.cache/npm), go (/go/pkg/mod). Verify: no unnecessary files in final image (use dive or docker history to inspect layers), no dev dependencies in production, no package manager cache in final layers. Measure image size: flag final images >100MB for Go/Rust/C, >200MB for Node/Python. Verify docker build time with warm cache <30s.",
          "verifies": [
            "layer ordering optimized (least-changing first)",
            "dependency manifests copied before source",
            "RUN commands combined for related operations",
            "--mount=type=cache for package managers",
            "no dev dependencies in final image",
            "no package manager cache in final layers",
            "image size within budget (dive inspected)",
            "build time with warm cache <30s"
          ]
        },
        {
          "agent": "custodian",
          "task_template": "Audit base image health and runtime efficiency for: ${goal}. Verify base images: actively maintained (updated within 3 months), from official or verified publishers, minimal variant used (alpine over debian, slim over full). Flag images with known vulnerabilities (docker scout cves or trivy image). Verify: no unnecessary packages installed (curl/wget removed after use or multi-stage), no debug tools in production (bash, shell, strace), runtime user has minimal filesystem access. Check multi-platform support: verify base images support linux/amd64 and linux/arm64 at minimum. Verify HEALTHCHECK uses lightweight probe (not full application request). Verify resource limits documented (--memory, --cpus recommendations).",
          "verifies": [
            "base images actively maintained (<3 months)",
            "base images from official/verified publishers",
            "minimal variant used (alpine/slim/distroless)",
            "no known CVEs in base images (scout/trivy)",
            "no debug tools in production image",
            "multi-platform support (amd64 + arm64)",
            "resource limits documented"
          ]
        }
      ],
      "checkpoint": "Layers optimized, image lean, base images verified, multi-platform ready",
      "abort_on_failure": true,
      "failure_message": "Performance gate failed. Poor layer ordering, bloated image, or vulnerable base detected."
    },
    {
      "phase": 2,
      "name": "Portability & Platform Parity",
      "gate": "portability",
      "principle": "Does it build and pass identically on every platform?",
      "mode": "hierarchical",
      "delegates": [
        {
          "agent": "inspector",